{
  "artifacts": {
    "aggregates_diel": {
      "present": false
    },
    "aggregates_effort": {
      "present": false
    },
    "detections": {
      "present": false
    },
    "model_version": {
      "bytes": 1651,
      "content_type": "application/json",
      "sha256": "13a6ada8fb699558887b5fdfb4d9b7c78d2c528afdebfcf60303ddf63af12cd5",
      "uri": "v1/model_version.json"
    },
    "preprocessing_spec": {
      "bytes": 2568,
      "content_type": "application/json",
      "sha256": "4b02ca76c6fa5ff7c3032641ad59d52f15b579b6278f902e1b30b472ea0711e9",
      "uri": "v1/preprocessing_spec.json"
    },
    "schemas": {
      "analysis_result": {
        "bytes": 1733,
        "content_type": "application/json",
        "sha256": "1c7810236fa4c5398e30f67d950e0946efca8d3a9979edbabc699e48acb1fa32",
        "uri": "v1/schema/analysis-result.schema.json"
      },
      "contract_manifest": {
        "bytes": 5990,
        "content_type": "application/json",
        "sha256": "54d54860269c87f9c076753a3cb339fca8d0a0bafb5b67da575092849f1ccd4d",
        "uri": "v1/schema/contract-manifest.schema.json"
      },
      "contract_pointer": {
        "bytes": 677,
        "content_type": "application/json",
        "sha256": "d101ccab16f01084d8c180fed71dd04b78665b606d7b1fe70aa9a126d48a31bf",
        "uri": "v1/schema/contract-pointer.schema.json"
      },
      "model_version": {
        "bytes": 4124,
        "content_type": "application/json",
        "sha256": "b1cf898d3a637b347c549790879b39c617b2ceb146d32673f8ec2818fe2a8407",
        "uri": "v1/schema/model-version.schema.json"
      },
      "preprocessing_spec": {
        "bytes": 3406,
        "content_type": "application/json",
        "sha256": "df569d3867ddd604380304e1684e9d0f24445e187c652cc7107a8647097075f1",
        "uri": "v1/schema/preprocessing-spec.schema.json"
      },
      "site": {
        "bytes": 3945,
        "content_type": "application/json",
        "sha256": "6bec9ebaf42fe518339e79a946f2b2b04d7a701ae282fd187d782e6bb7dcae0d",
        "uri": "v1/schema/site.schema.json"
      }
    },
    "sites": {
      "bytes": 54081,
      "content_type": "application/json",
      "count": 54,
      "sha256": "10a4e0567107c76b4e6b788fdcc6792f5b18302a05f7354d3672169f7b321406",
      "uri": "v1/sites.json"
    },
    "stamp": {
      "bytes": 187,
      "content_type": "application/json",
      "sha256": "4f67a0569b99b4e2fd2af2d462520b4aa1fe8a80f46e636b38c85b10121e79b6",
      "uri": "v1/stamp.json"
    }
  },
  "contract_version": 1,
  "coverage": {
    "countries": 7,
    "has_detections": false,
    "has_diel": false,
    "has_effort": false,
    "has_pre_post_event": false,
    "sites_with_embeddings": 48,
    "total_sites": 54
  },
  "dataset_version": "reefradar-reference-2026.10.0",
  "datasets": [
    {
      "doi": "10.5522/04/29958062",
      "doi_note": null,
      "id": "marrs",
      "licence": "CC BY 4.0",
      "licence_url": "https://creativecommons.org/licenses/by/4.0/",
      "name": "MARRS (Mars Assisted Reef Restoration System)",
      "title": "Coral Reef Soundscapes from a Global Restoration Programme",
      "url": "https://doi.org/10.5522/04/29958062"
    },
    {
      "doi": "10.5281/zenodo.14577064",
      "doi_note": null,
      "id": "coralsoundexplorer",
      "licence": "CC BY 4.0",
      "licence_url": "https://creativecommons.org/licenses/by/4.0/",
      "name": "CoralSoundExplorer",
      "title": "Visualization and quantification of coral reef soundscapes using CoralSoundExplorer software",
      "url": "https://zenodo.org/records/14577064"
    },
    {
      "doi": "10.5061/dryad.5tb2rbp38",
      "doi_note": null,
      "id": "irma",
      "licence": "CC0 1.0 (Public Domain Dedication)",
      "licence_url": "https://spdx.org/licenses/CC0-1.0.html",
      "name": "Hurricane Irma Dataset",
      "title": "Hurricane impacts on a coral reef soundscape",
      "url": "https://datadryad.org/dataset/doi:10.5061/dryad.5tb2rbp38"
    },
    {
      "doi": null,
      "doi_note": "SanctSound issues per-site, per-detection-type DOIs at NCEI (e.g. 10.25921/PF0H-SQ72) rather than one collection-level DOI — confirmed live this session against the NCEI passive-acoustic-data page. No single DOI exists for the project as a whole, so doi is recorded null and the project landing page is used as the canonical url. Underlying archive filenames (NOAA-Navy-SanctSound_*) show the U.S. Navy as a co-contributing data partner alongside NOAA ONMS.",
      "id": "sanctsound",
      "licence": "Public domain (U.S. Government work)",
      "licence_url": null,
      "name": "NOAA SanctSound",
      "title": "Sanctuary Soundscape Monitoring Project (SanctSound)",
      "url": "https://sanctsound.ioos.us/"
    }
  ],
  "frozen_at": "2026-10-01T22:10:03Z",
  "model_version": "interim-real-only",
  "preprocessing_spec_version": "preproc-2026.10.0-as-deployed",
  "schema_version": 1,
  "sources": {
    "citations": {
      "path": "dashboard-next/src/data/citations.json",
      "schema_version": 1,
      "sha256": "93a4d5901d52d2b0e22449abac27f8a1abe6a877aa6b582896c1b547a93c09b6",
      "verified_at": "2026-10-01"
    },
    "provenance": {
      "path": "data/site-label-provenance.json",
      "schema_version": 1,
      "sha256": "c44128d61fa1088cac2b81cac8d70fddfcd979edb50de9713945266c90cff109"
    },
    "snapshot": {
      "path": "data/snapshots/api-sites.json",
      "sha256": "bb3c5582c6b07b2fc6d580917c826b8d2815efb089951c9b9a0586b9f7b1a15c",
      "snapshot_at": "2026-10-01T06:23:53Z",
      "version": "6.0"
    }
  }
}
